{
    "apiVersion": "1.0.0", 
    "datasets": {
        "613344d9-4a9d-11e5-8ca2-3c15c2da029e": {
            "alias": [
                "/DS1"
            ], 
            "creationProperties": {
                "allocTime": "H5D_ALLOC_TIME_LATE", 
                "fillTime": "H5D_FILL_TIME_IFSET", 
                "fillValue": [
                    [
                        0, 
                        0, 
                        4301258764, 
                        0, 
                        0
                    ], 
                    [
                        0, 
                        0, 
                        0, 
                        0, 
                        -5803105942641292133
                    ], 
                    [
                        4301365008, 
                        4297860608, 
                        7012041387394527100, 
                        4301375792, 
                        4347480760
                    ]
                ], 
                "layout": {
                    "class": "H5D_CONTIGUOUS"
                }
            }, 
            "shape": {
                "class": "H5S_SIMPLE", 
                "dims": [
                    4
                ]
            }, 
            "type": {
                "base": {
                    "base": "H5T_STD_I64LE", 
                    "class": "H5T_INTEGER"
                }, 
                "class": "H5T_ARRAY", 
                "dims": [
                    3, 
                    5
                ]
            }, 
            "value": [
                [
                    [
                        0, 
                        0, 
                        0, 
                        0, 
                        0
                    ], 
                    [
                        0, 
                        -1, 
                        -2, 
                        -3, 
                        -4
                    ], 
                    [
                        0, 
                        -2, 
                        -4, 
                        -6, 
                        -8
                    ]
                ], 
                [
                    [
                        0, 
                        1, 
                        2, 
                        3, 
                        4
                    ], 
                    [
                        1, 
                        1, 
                        1, 
                        1, 
                        1
                    ], 
                    [
                        2, 
                        1, 
                        0, 
                        -1, 
                        -2
                    ]
                ], 
                [
                    [
                        0, 
                        2, 
                        4, 
                        6, 
                        8
                    ], 
                    [
                        2, 
                        3, 
                        4, 
                        5, 
                        6
                    ], 
                    [
                        4, 
                        4, 
                        4, 
                        4, 
                        4
                    ]
                ], 
                [
                    [
                        0, 
                        3, 
                        6, 
                        9, 
                        12
                    ], 
                    [
                        3, 
                        5, 
                        7, 
                        9, 
                        11
                    ], 
                    [
                        6, 
                        7, 
                        8, 
                        9, 
                        10
                    ]
                ]
            ]
        }
    }, 
    "groups": {
        "6131fede-4a9d-11e5-b721-3c15c2da029e": {
            "alias": [
                "/"
            ], 
            "links": [
                {
                    "class": "H5L_TYPE_HARD", 
                    "collection": "datasets", 
                    "id": "613344d9-4a9d-11e5-8ca2-3c15c2da029e", 
                    "title": "DS1"
                }
            ]
        }
    }, 
    "root": "6131fede-4a9d-11e5-b721-3c15c2da029e"
}
