{
    "apiVersion": "1.0.0", 
    "datasets": {
        "9c1f15c7-83f8-11e5-8870-3c15c2da029e": {
            "alias": [
                "/dset1"
            ], 
            "creationProperties": {
                "allocTime": "H5D_ALLOC_TIME_LATE", 
                "fillTime": "H5D_FILL_TIME_IFSET", 
                "layout": {
                    "class": "H5D_CONTIGUOUS"
                }
            }, 
            "shape": {
                "class": "H5S_SIMPLE", 
                "dims": [
                    10
                ]
            }, 
            "type": {
                "base": "H5T_IEEE_F32LE", 
                "class": "H5T_FLOAT"
            }, 
            "value": [
                0.0, 
                0.0, 
                0.0, 
                0.0, 
                0.0, 
                0.0, 
                0.0, 
                0.0, 
                0.0, 
                0.0
            ]
        }
    }, 
    "groups": {
        "9c1d7c8c-83f8-11e5-af5e-3c15c2da029e": {
            "alias": [
                "/"
            ], 
            "links": [
                {
                    "class": "H5L_TYPE_HARD", 
                    "collection": "datasets", 
                    "id": "9c1f15c7-83f8-11e5-8870-3c15c2da029e", 
                    "title": "dset1"
                }
            ]
        }
    }, 
    "root": "9c1d7c8c-83f8-11e5-af5e-3c15c2da029e"
}
