{
    "apiVersion": "1.0.0", 
    "datatypes": {
        "79c561de-4a9d-11e5-a5c8-3c15c2da029e": {
            "alias": [
                "/dtype_compound"
            ], 
            "type": {
                "class": "H5T_COMPOUND", 
                "fields": [
                    {
                        "name": "temp", 
                        "type": {
                            "base": "H5T_STD_I32LE", 
                            "class": "H5T_INTEGER"
                        }
                    }, 
                    {
                        "name": "pressure", 
                        "type": {
                            "base": "H5T_IEEE_F32LE", 
                            "class": "H5T_FLOAT"
                        }
                    }
                ]
            }
        }, 
        "79c5769c-4a9d-11e5-950e-3c15c2da029e": {
            "alias": [
                "/dtype_simple"
            ], 
            "attributes": [
                {
                    "name": "note", 
                    "shape": {
                        "class": "H5S_SCALAR"
                    }, 
                    "type": {
                        "charSet": "H5T_CSET_ASCII", 
                        "class": "H5T_STRING", 
                        "length": "H5T_VARIABLE", 
                        "strPad": "H5T_STR_NULLTERM"
                    }, 
                    "value": "this is a committed datatype of float32"
                }
            ], 
            "type": {
                "base": "H5T_IEEE_F32LE", 
                "class": "H5T_FLOAT"
            }
        }
    }, 
    "groups": {
        "79c44830-4a9d-11e5-9b42-3c15c2da029e": {
            "alias": [
                "/"
            ], 
            "links": [
                {
                    "class": "H5L_TYPE_HARD", 
                    "collection": "datatypes", 
                    "id": "79c561de-4a9d-11e5-a5c8-3c15c2da029e", 
                    "title": "dtype_compound"
                }, 
                {
                    "class": "H5L_TYPE_HARD", 
                    "collection": "datatypes", 
                    "id": "79c5769c-4a9d-11e5-950e-3c15c2da029e", 
                    "title": "dtype_simple"
                }
            ]
        }
    }, 
    "root": "79c44830-4a9d-11e5-9b42-3c15c2da029e"
}
