{
    "apiVersion": "1.0.0", 
    "datasets": {
        "847bbfc7-4a9d-11e5-be47-3c15c2da029e": {
            "alias": [
                "/DS1"
            ], 
            "attributes": [
                {
                    "name": "A1", 
                    "shape": {
                        "class": "H5S_SIMPLE", 
                        "dims": [
                            4
                        ]
                    }, 
                    "type": {
                        "charSet": "H5T_CSET_ASCII", 
                        "class": "H5T_STRING", 
                        "length": "H5T_VARIABLE", 
                        "strPad": "H5T_STR_NULLTERM"
                    }, 
                    "value": [
                        "Parting", 
                        "is such", 
                        "sweet", 
                        "sorrow."
                    ]
                }
            ], 
            "creationProperties": {
                "allocTime": "H5D_ALLOC_TIME_LATE", 
                "fillTime": "H5D_FILL_TIME_IFSET", 
                "fillValue": 0, 
                "layout": {
                    "class": "H5D_CONTIGUOUS"
                }
            }, 
            "shape": {
                "class": "H5S_NULL"
            }, 
            "type": {
                "base": "H5T_STD_I32LE", 
                "class": "H5T_INTEGER"
            }, 
            "value": null
        }
    }, 
    "groups": {
        "847a8963-4a9d-11e5-b169-3c15c2da029e": {
            "alias": [
                "/"
            ], 
            "links": [
                {
                    "class": "H5L_TYPE_HARD", 
                    "collection": "datasets", 
                    "id": "847bbfc7-4a9d-11e5-be47-3c15c2da029e", 
                    "title": "DS1"
                }
            ]
        }
    }, 
    "root": "847a8963-4a9d-11e5-b169-3c15c2da029e"
}
