{
    "apiVersion": "1.1.0",
    "datasets": {
        "8752a454-05e2-11e7-900a-3c15c2da029e": {
            "alias": [
                "/DS1"
            ],
            "creationProperties": {
                "allocTime": "H5D_ALLOC_TIME_LATE",
                "fillTime": "H5D_FILL_TIME_IFSET",
                "layout": {
                    "class": "H5D_CONTIGUOUS"
                }
            },
            "shape": {
                "class": "H5S_SCALAR"
            },
            "type": {
                "base": {
                    "base": "H5T_IEEE_F32LE",
                    "class": "H5T_FLOAT"
                },
                "class": "H5T_ARRAY",
                "dims": [
                    3,
                    2
                ]
            },
            "value": [
                [
                    0.0,
                    0.0
                ],
                [
                    0.0,
                    0.0
                ],
                [
                    0.0,
                    0.0
                ]
            ]
        }
    },
    "groups": {
        "8750b178-05e2-11e7-b6e4-3c15c2da029e": {
            "alias": [
                "/"
            ],
            "links": [
                {
                    "class": "H5L_TYPE_HARD",
                    "collection": "datasets",
                    "id": "8752a454-05e2-11e7-900a-3c15c2da029e",
                    "title": "DS1"
                }
            ]
        }
    },
    "root": "8750b178-05e2-11e7-b6e4-3c15c2da029e"
}
