{
    "apiVersion": "1.0.0", 
    "datasets": {
        "78adfc4a-4a9d-11e5-8f36-3c15c2da029e": {
            "alias": [
                "/DS1"
            ], 
            "creationProperties": {
                "allocTime": "H5D_ALLOC_TIME_LATE", 
                "fillTime": "H5D_FILL_TIME_IFSET", 
                "fillValue": 0, 
                "layout": {
                    "class": "H5D_CONTIGUOUS"
                }
            }, 
            "shape": {
                "class": "H5S_SIMPLE", 
                "dims": [
                    6, 
                    8
                ]
            }, 
            "type": {
                "base": "H5T_STD_I32LE", 
                "class": "H5T_INTEGER"
            }, 
            "value": [
                [
                    0, 
                    1, 
                    0, 
                    0, 
                    1, 
                    0, 
                    0, 
                    1
                ], 
                [
                    1, 
                    1, 
                    0, 
                    1, 
                    1, 
                    0, 
                    1, 
                    1
                ], 
                [
                    0, 
                    0, 
                    0, 
                    0, 
                    0, 
                    0, 
                    0, 
                    0
                ], 
                [
                    0, 
                    1, 
                    0, 
                    0, 
                    1, 
                    0, 
                    0, 
                    1
                ], 
                [
                    1, 
                    1, 
                    0, 
                    1, 
                    1, 
                    0, 
                    1, 
                    1
                ], 
                [
                    0, 
                    0, 
                    0, 
                    0, 
                    0, 
                    0, 
                    0, 
                    0
                ]
            ]
        }
    }, 
    "groups": {
        "78acd8a6-4a9d-11e5-ad66-3c15c2da029e": {
            "alias": [
                "/"
            ], 
            "links": [
                {
                    "class": "H5L_TYPE_HARD", 
                    "collection": "datasets", 
                    "id": "78adfc4a-4a9d-11e5-8f36-3c15c2da029e", 
                    "title": "DS1"
                }
            ]
        }
    }, 
    "root": "78acd8a6-4a9d-11e5-ad66-3c15c2da029e"
}
