{
    "apiVersion": "1.1.1",
    "datasets": {
        "01d05532-2eebac23-a64e-65fd11-2f5f85": {
            "alias": [
                "/DS1"
            ],
            "creationProperties": {
                "allocTime": "H5D_ALLOC_TIME_LATE",
                "fillTime": "H5D_FILL_TIME_IFSET",
                "layout": {
                    "class": "H5D_CONTIGUOUS"
                }
            },
            "shape": {
                "class": "H5S_SIMPLE",
                "dims": [
                    10
                ]
            },
            "type": {
                "class": "H5T_COMPOUND",
                "fields": [
                    {
                        "name": "temp",
                        "type": {
                            "base": "H5T_IEEE_F64LE",
                            "class": "H5T_FLOAT"
                        }
                    },
                    {
                        "name": "2x2",
                        "type": {
                            "base": {
                                "base": "H5T_IEEE_F32LE",
                                "class": "H5T_FLOAT"
                            },
                            "class": "H5T_ARRAY",
                            "dims": [
                                2,
                                2
                            ]
                        }
                    }
                ]
            },
            "value": [
                [
                    0.0,
                    [
                        [
                            -1.0,
                            1.0
                        ],
                        [
                            -2.0,
                            2.0
                        ]
                    ]
                ],
                [
                    3.12,
                    [
                        [
                            -2.0,
                            2.0
                        ],
                        [
                            -3.0,
                            3.0
                        ]
                    ]
                ],
                [
                    6.24,
                    [
                        [
                            -3.0,
                            3.0
                        ],
                        [
                            -4.0,
                            4.0
                        ]
                    ]
                ],
                [
                    9.36,
                    [
                        [
                            -4.0,
                            4.0
                        ],
                        [
                            -5.0,
                            5.0
                        ]
                    ]
                ],
                [
                    12.48,
                    [
                        [
                            -5.0,
                            5.0
                        ],
                        [
                            -6.0,
                            6.0
                        ]
                    ]
                ],
                [
                    15.600000000000001,
                    [
                        [
                            -6.0,
                            6.0
                        ],
                        [
                            -7.0,
                            7.0
                        ]
                    ]
                ],
                [
                    18.72,
                    [
                        [
                            -7.0,
                            7.0
                        ],
                        [
                            -8.0,
                            8.0
                        ]
                    ]
                ],
                [
                    21.84,
                    [
                        [
                            -8.0,
                            8.0
                        ],
                        [
                            -9.0,
                            9.0
                        ]
                    ]
                ],
                [
                    24.96,
                    [
                        [
                            -9.0,
                            9.0
                        ],
                        [
                            -10.0,
                            10.0
                        ]
                    ]
                ],
                [
                    28.080000000000002,
                    [
                        [
                            -10.0,
                            10.0
                        ],
                        [
                            -11.0,
                            11.0
                        ]
                    ]
                ]
            ]
        }
    },
    "groups": {
        "01d05532-2eebac23-8958-ddbaa6-6324ab": {
            "alias": [
                "/"
            ],
            "links": [
                {
                    "class": "H5L_TYPE_HARD",
                    "collection": "datasets",
                    "id": "01d05532-2eebac23-a64e-65fd11-2f5f85",
                    "title": "DS1"
                }
            ]
        }
    },
    "root": "01d05532-2eebac23-8958-ddbaa6-6324ab"
}
