{
    "apiVersion": "1.0.0", 
    "datasets": {
        "6fc23451-4a9d-11e5-b3aa-3c15c2da029e": {
            "alias": [
                "/DS1"
            ], 
            "creationProperties": {
                "allocTime": "H5D_ALLOC_TIME_LATE", 
                "fillTime": "H5D_FILL_TIME_IFSET", 
                "fillValue": "", 
                "layout": {
                    "class": "H5D_CONTIGUOUS"
                }
            }, 
            "shape": {
                "class": "H5S_SIMPLE", 
                "dims": [
                    4
                ]
            }, 
            "type": {
                "charSet": "H5T_CSET_ASCII", 
                "class": "H5T_STRING", 
                "length": 7, 
                "strPad": "H5T_STR_NULLPAD"
            }, 
            "value": [
                "Parting", 
                "is such", 
                "sweet", 
                "sorrow."
            ]
        }
    }, 
    "groups": {
        "6fc1268f-4a9d-11e5-a56a-3c15c2da029e": {
            "alias": [
                "/"
            ], 
            "links": [
                {
                    "class": "H5L_TYPE_HARD", 
                    "collection": "datasets", 
                    "id": "6fc23451-4a9d-11e5-b3aa-3c15c2da029e", 
                    "title": "DS1"
                }
            ]
        }
    }, 
    "root": "6fc1268f-4a9d-11e5-a56a-3c15c2da029e"
}
