{
    "apiVersion": "1.0.0", 
    "datasets": {
        "7a401c63-4a9d-11e5-9046-3c15c2da029e": {
            "alias": [
                "/DS1"
            ], 
            "attributes": [
                {
                    "name": "A1", 
                    "shape": {
                        "class": "H5S_SIMPLE", 
                        "dims": [
                            2
                        ]
                    }, 
                    "type": {
                        "base": "H5T_STD_REF_OBJ", 
                        "class": "H5T_REFERENCE"
                    }, 
                    "value": [
                        "groups/7a40478c-4a9d-11e5-8acf-3c15c2da029e", 
                        "datasets/7a4033d4-4a9d-11e5-bfa2-3c15c2da029e"
                    ]
                }
            ], 
            "creationProperties": {
                "allocTime": "H5D_ALLOC_TIME_LATE", 
                "fillTime": "H5D_FILL_TIME_IFSET", 
                "fillValue": 0, 
                "layout": {
                    "class": "H5D_CONTIGUOUS"
                }
            }, 
            "shape": {
                "class": "H5S_NULL"
            }, 
            "type": {
                "base": "H5T_STD_I32LE", 
                "class": "H5T_INTEGER"
            }, 
            "value": null
        }, 
        "7a4033d4-4a9d-11e5-bfa2-3c15c2da029e": {
            "alias": [
                "/DS2"
            ], 
            "creationProperties": {
                "allocTime": "H5D_ALLOC_TIME_LATE", 
                "fillTime": "H5D_FILL_TIME_IFSET", 
                "fillValue": 0, 
                "layout": {
                    "class": "H5D_CONTIGUOUS"
                }
            }, 
            "shape": {
                "class": "H5S_NULL"
            }, 
            "type": {
                "base": "H5T_STD_I32LE", 
                "class": "H5T_INTEGER"
            }, 
            "value": null
        }
    }, 
    "groups": {
        "7a3ed19c-4a9d-11e5-adbe-3c15c2da029e": {
            "alias": [
                "/"
            ], 
            "links": [
                {
                    "class": "H5L_TYPE_HARD", 
                    "collection": "datasets", 
                    "id": "7a401c63-4a9d-11e5-9046-3c15c2da029e", 
                    "title": "DS1"
                }, 
                {
                    "class": "H5L_TYPE_HARD", 
                    "collection": "datasets", 
                    "id": "7a4033d4-4a9d-11e5-bfa2-3c15c2da029e", 
                    "title": "DS2"
                }, 
                {
                    "class": "H5L_TYPE_HARD", 
                    "collection": "groups", 
                    "id": "7a40478c-4a9d-11e5-8acf-3c15c2da029e", 
                    "title": "G1"
                }
            ]
        }, 
        "7a40478c-4a9d-11e5-8acf-3c15c2da029e": {
            "alias": [
                "/G1"
            ]
        }
    }, 
    "root": "7a3ed19c-4a9d-11e5-adbe-3c15c2da029e"
}
