{
    "apiVersion": "1.0.0", 
    "datasets": {
        "7b128ec5-4a9d-11e5-883f-3c15c2da029e": {
            "alias": [
                "/0d"
            ], 
            "creationProperties": {
                "allocTime": "H5D_ALLOC_TIME_LATE", 
                "fillTime": "H5D_FILL_TIME_IFSET", 
                "fillValue": 0, 
                "layout": {
                    "class": "H5D_CONTIGUOUS"
                }
            }, 
            "shape": {
                "class": "H5S_SCALAR"
            }, 
            "type": {
                "base": "H5T_STD_I32LE", 
                "class": "H5T_INTEGER"
            }, 
            "value": 42
        }, 
        "7b12b7fa-4a9d-11e5-bc9b-3c15c2da029e": {
            "alias": [
                "/0ds"
            ], 
            "creationProperties": {
                "allocTime": "H5D_ALLOC_TIME_LATE", 
                "fillTime": "H5D_FILL_TIME_ALLOC", 
                "layout": {
                    "class": "H5D_CONTIGUOUS"
                }
            }, 
            "shape": {
                "class": "H5S_SCALAR"
            }, 
            "type": {
                "charSet": "H5T_CSET_ASCII", 
                "class": "H5T_STRING", 
                "length": "H5T_VARIABLE", 
                "strPad": "H5T_STR_NULLTERM"
            }, 
            "value": "hello"
        }, 
        "7b12ce17-4a9d-11e5-bfc6-3c15c2da029e": {
            "alias": [
                "/1d"
            ], 
            "creationProperties": {
                "allocTime": "H5D_ALLOC_TIME_LATE", 
                "fillTime": "H5D_FILL_TIME_IFSET", 
                "fillValue": 0, 
                "layout": {
                    "class": "H5D_CONTIGUOUS"
                }
            }, 
            "shape": {
                "class": "H5S_SIMPLE", 
                "dims": [
                    1
                ]
            }, 
            "type": {
                "base": "H5T_STD_I32LE", 
                "class": "H5T_INTEGER"
            }, 
            "value": [
                42
            ]
        }, 
        "7b12e391-4a9d-11e5-b0c4-3c15c2da029e": {
            "alias": [
                "/1ds"
            ], 
            "creationProperties": {
                "allocTime": "H5D_ALLOC_TIME_LATE", 
                "fillTime": "H5D_FILL_TIME_ALLOC", 
                "layout": {
                    "class": "H5D_CONTIGUOUS"
                }
            }, 
            "shape": {
                "class": "H5S_SIMPLE", 
                "dims": [
                    1
                ]
            }, 
            "type": {
                "charSet": "H5T_CSET_ASCII", 
                "class": "H5T_STRING", 
                "length": "H5T_VARIABLE", 
                "strPad": "H5T_STR_NULLTERM"
            }, 
            "value": [
                "hello"
            ]
        }
    }, 
    "groups": {
        "7b117ffd-4a9d-11e5-865c-3c15c2da029e": {
            "alias": [
                "/"
            ], 
            "attributes": [
                {
                    "name": "attr1", 
                    "shape": {
                        "class": "H5S_SCALAR"
                    }, 
                    "type": {
                        "base": "H5T_STD_I64LE", 
                        "class": "H5T_INTEGER"
                    }, 
                    "value": 42
                }, 
                {
                    "name": "attr2", 
                    "shape": {
                        "class": "H5S_SCALAR"
                    }, 
                    "type": {
                        "charSet": "H5T_CSET_ASCII", 
                        "class": "H5T_STRING", 
                        "length": "H5T_VARIABLE", 
                        "strPad": "H5T_STR_NULLTERM"
                    }, 
                    "value": "hello"
                }
            ], 
            "links": [
                {
                    "class": "H5L_TYPE_HARD", 
                    "collection": "datasets", 
                    "id": "7b128ec5-4a9d-11e5-883f-3c15c2da029e", 
                    "title": "0d"
                }, 
                {
                    "class": "H5L_TYPE_HARD", 
                    "collection": "datasets", 
                    "id": "7b12b7fa-4a9d-11e5-bc9b-3c15c2da029e", 
                    "title": "0ds"
                }, 
                {
                    "class": "H5L_TYPE_HARD", 
                    "collection": "datasets", 
                    "id": "7b12ce17-4a9d-11e5-bfc6-3c15c2da029e", 
                    "title": "1d"
                }, 
                {
                    "class": "H5L_TYPE_HARD", 
                    "collection": "datasets", 
                    "id": "7b12e391-4a9d-11e5-b0c4-3c15c2da029e", 
                    "title": "1ds"
                }
            ]
        }
    }, 
    "root": "7b117ffd-4a9d-11e5-865c-3c15c2da029e"
}
