{
    "apiVersion": "1.1.1",
    "datasets": {
        "83fefa97-82b10ff9-5f45-da0a54-668d61": {
            "alias": [
                "/DS1"
            ],
            "attributes": [
                {
                    "encoding": "base64",
                    "name": "A1",
                    "shape": {
                        "class": "H5S_SIMPLE",
                        "dims": [
                            4
                        ]
                    },
                    "type": {
                        "class": "H5T_OPAQUE",
                        "size": 7
                    },
                    "value": [
                        "T1BBUVVFMA==",
                        "T1BBUVVFMQ==",
                        "T1BBUVVFMg==",
                        "T1BBUVVFMw=="
                    ]
                }
            ],
            "creationProperties": {
                "allocTime": "H5D_ALLOC_TIME_LATE",
                "fillTime": "H5D_FILL_TIME_IFSET",
                "layout": {
                    "class": "H5D_CONTIGUOUS"
                }
            },
            "shape": {
                "class": "H5S_NULL"
            },
            "type": {
                "base": "H5T_STD_I32LE",
                "class": "H5T_INTEGER"
            }
        }
    },
    "groups": {
        "83fefa97-82b10ff9-0b76-721f0a-398771": {
            "alias": [
                "/"
            ],
            "links": [
                {
                    "class": "H5L_TYPE_HARD",
                    "collection": "datasets",
                    "id": "83fefa97-82b10ff9-5f45-da0a54-668d61",
                    "title": "DS1"
                }
            ]
        }
    },
    "root": "83fefa97-82b10ff9-0b76-721f0a-398771"
}
