{
    "apiVersion": "1.1.1",
    "datasets": {
        "dd3c0639-08f44d29-06b9-a92530-a0d73b": {
            "alias": [
                "/DS1"
            ],
            "attributes": [
                {
                    "name": "A1",
                    "shape": {
                        "class": "H5S_SCALAR"
                    },
                    "type": {
                        "class": "H5T_COMPOUND",
                        "fields": [
                            {
                                "name": "temp",
                                "type": {
                                    "base": "H5T_IEEE_F64LE",
                                    "class": "H5T_FLOAT"
                                }
                            },
                            {
                                "name": "2x2",
                                "type": {
                                    "base": {
                                        "base": "H5T_IEEE_F32LE",
                                        "class": "H5T_FLOAT"
                                    },
                                    "class": "H5T_ARRAY",
                                    "dims": [
                                        2,
                                        2
                                    ]
                                }
                            }
                        ]
                    },
                    "value": [
                        3.12,
                        [
                            [
                                -1.0,
                                1.0
                            ],
                            [
                                -2.0,
                                2.0
                            ]
                        ]
                    ]
                }
            ],
            "creationProperties": {
                "allocTime": "H5D_ALLOC_TIME_LATE",
                "fillTime": "H5D_FILL_TIME_IFSET",
                "layout": {
                    "class": "H5D_CONTIGUOUS"
                }
            },
            "shape": {
                "class": "H5S_NULL"
            },
            "type": {
                "base": "H5T_STD_I32LE",
                "class": "H5T_INTEGER"
            }
        }
    },
    "groups": {
        "dd3c0639-08f44d29-55b4-8eb180-7cc5a1": {
            "alias": [
                "/"
            ],
            "links": [
                {
                    "class": "H5L_TYPE_HARD",
                    "collection": "datasets",
                    "id": "dd3c0639-08f44d29-06b9-a92530-a0d73b",
                    "title": "DS1"
                }
            ]
        }
    },
    "root": "dd3c0639-08f44d29-55b4-8eb180-7cc5a1"
}
