{
    "apiVersion": "1.0.0", 
    "datasets": {
        "79f6b0ae-4a9d-11e5-8d7b-3c15c2da029e": {
            "alias": [
                "/DS1"
            ], 
            "creationProperties": {
                "allocTime": "H5D_ALLOC_TIME_LATE", 
                "fillTime": "H5D_FILL_TIME_IFSET", 
                "layout": {
                    "class": "H5D_CONTIGUOUS"
                }
            }, 
            "shape": {
                "class": "H5S_SIMPLE", 
                "dims": [
                    1
                ]
            }, 
            "type": {
                "base": "H5T_STD_REF_OBJ", 
                "class": "H5T_REFERENCE"
            }, 
            "value": [
                "null"
            ]
        }
    }, 
    "groups": {
        "79f59b45-4a9d-11e5-a2d0-3c15c2da029e": {
            "alias": [
                "/"
            ], 
            "links": [
                {
                    "class": "H5L_TYPE_HARD", 
                    "collection": "datasets", 
                    "id": "79f6b0ae-4a9d-11e5-8d7b-3c15c2da029e", 
                    "title": "DS1"
                }
            ]
        }
    }, 
    "root": "79f59b45-4a9d-11e5-a2d0-3c15c2da029e"
}
